{
  "$schema": "./schema/lld.schema.json",
  "status_options": [
    {
      "id": "todo",
      "label": "Not started"
    },
    {
      "id": "practiced",
      "label": "Practiced"
    },
    {
      "id": "ready",
      "label": "Ready"
    }
  ],
  "workflow": [
    "Restate the requirements and list states, entities, and invariants yourself before touching the AI.",
    "Sketch the classes and interfaces by hand: who owns which state, and which methods change it.",
    "Ask the AI for boilerplate only: enums, dataclasses, test scaffolding.",
    "Review every generated block out loud: thread safety, single responsibility, missing states, edge cases, leaked internals.",
    "Run the tests, then add a concurrency test and an edge-case test the AI did not write.",
    "Close with trade-offs and what you would change at scale."
  ],
  "pattern_cards": [
    {
      "id": "strategy",
      "name": "Strategy",
      "when": "Several interchangeable algorithms behind one interface, chosen at runtime.",
      "sketch": "class RateLimiter(Protocol):\n    def allow(self, cost: float = 1.0) -> bool: ...\n\nlimiter: RateLimiter = TokenBucket(10, 5)  # or SlidingWindowLog(...)",
      "pitfalls": [
        "Do not add a Strategy for a single implementation.",
        "Keep the interface small."
      ]
    },
    {
      "id": "observer",
      "name": "Observer",
      "when": "Other parts of the system react to events without the publisher knowing them.",
      "sketch": "class Listener(Protocol):\n    def on_event(self, e) -> None: ...\n\nfor l in list(listeners):\n    try:\n        l.on_event(e)\n    except Exception:\n        log_failure(l, e)",
      "pitfalls": [
        "Iterate over a copy.",
        "Isolate listener failures.",
        "Do not call listeners while holding a lock."
      ]
    },
    {
      "id": "state",
      "name": "State",
      "when": "Behavior depends on a status with strict allowed moves.",
      "sketch": "TABLE = {\n    (Status.OPEN, Event.ACK): Status.ACKNOWLEDGED,\n    (Status.ACKNOWLEDGED, Event.RESOLVE): Status.RESOLVED,\n}\nnext_status = TABLE[(current, event)]  # KeyError means illegal",
      "pitfalls": [
        "Make terminal states explicit.",
        "Validate before recording.",
        "A class per state only pays off when states carry lots of behavior."
      ]
    },
    {
      "id": "factory",
      "name": "Factory",
      "when": "Callers need an object but should not know which class or how it is built.",
      "sketch": "class Registry:\n    def __init__(self, make):\n        self._make, self._items = make, {}\n    def get(self, key):\n        if key not in self._items:\n            self._items[key] = self._make()\n        return self._items[key]",
      "pitfalls": [
        "Creation on first use must be thread-safe.",
        "Skip it when a constructor is enough."
      ]
    },
    {
      "id": "builder",
      "name": "Builder",
      "when": "An object has many optional parts and must be valid when finished.",
      "sketch": "job = (JobBuilder('nightly-feed')\n       .every('1d')\n       .retries(3)\n       .timeout(1800)\n       .build())  # validates here",
      "pitfalls": [
        "In Python, keyword arguments and dataclasses often replace it.",
        "Validate in build(), not in every setter."
      ]
    },
    {
      "id": "locks",
      "name": "Locks and concurrent maps",
      "when": "Shared mutable state touched by several threads.",
      "sketch": "with self._lock:  # check and act together\n    current = self._state.get(key)\n    if allowed(current, target):\n        self._state[key] = target\n# do slow work (I/O, callbacks) outside the lock",
      "pitfalls": [
        "Check-then-act races are the classic bug.",
        "Never call out to unknown code while holding a lock.",
        "Start with one lock; shard by key when contention shows up.",
        "In Python, the GIL does not make compound operations atomic."
      ]
    }
  ],
  "problems": [
    {
      "id": "workflow-step-logger",
      "title": "Workflow step state-transition logger",
      "reported": true,
      "pinned": true,
      "difficulty": "medium",
      "prompt": "Design a component that logs state transitions for steps in a workflow engine. Reported in 2026 Salesforce onsite AI-assisted OOD rounds.",
      "requirements": [
        "Record every state change of a workflow step: who, when, from, to, and why.",
        "Reject illegal transitions, such as moving a finished step back to running.",
        "Query the full history and the current state of any step.",
        "Notify listeners (alerts, metrics) without slowing down logging.",
        "Safe when many workers update steps at once."
      ],
      "entities": [
        {
          "name": "StepState",
          "role": "Enum of states: pending, running, retrying, succeeded, failed, cancelled."
        },
        {
          "name": "Transition",
          "role": "Immutable record of one change."
        },
        {
          "name": "TransitionPolicy",
          "role": "Which moves are legal; swappable."
        },
        {
          "name": "InMemoryTransitionStore",
          "role": "Append-only history per workflow and step; swappable for a database."
        },
        {
          "name": "TransitionListener",
          "role": "Anything that wants to react to a change."
        },
        {
          "name": "WorkflowStepLogger",
          "role": "Facade that validates, stores, and notifies."
        }
      ],
      "diagram": "classDiagram\n  class WorkflowStepLogger {\n    +record(workflow_id, step_id, to_state, actor) Transition\n    +history(workflow_id, step_id) list\n    +current_state(workflow_id, step_id) StepState\n    +subscribe(listener)\n  }\n  class TransitionPolicy {\n    +check(current, target)\n  }\n  class InMemoryTransitionStore {\n    +append(t)\n    +history(workflow_id, step_id) list\n    +current(workflow_id, step_id) StepState\n  }\n  class Transition {\n    workflow_id\n    step_id\n    from_state\n    to_state\n    at\n    actor\n  }\n  class TransitionListener {\n    +on_transition(t)\n  }\n  WorkflowStepLogger --> TransitionPolicy\n  WorkflowStepLogger --> InMemoryTransitionStore\n  WorkflowStepLogger --> TransitionListener : notifies\n  InMemoryTransitionStore o-- Transition",
      "interfaces": [
        "record(workflow_id, step_id, to_state, actor, reason): validate and append; returns the Transition.",
        "history(workflow_id, step_id): a copy of every transition, oldest first.",
        "current_state(workflow_id, step_id): latest state, or None if never seen.",
        "subscribe(listener): listener.on_transition(t) is called after each record."
      ],
      "patterns": [
        "strategy",
        "observer",
        "state",
        "locks"
      ],
      "concurrency": [
        "Reading the current state and appending must happen under one lock, or two workers can both start the same step.",
        "Listeners run outside the lock so a slow one cannot block writers.",
        "One global lock is the simple start; per-key locks or a database row lock scale further.",
        "Transitions are immutable, so they are safe to share across threads."
      ],
      "solution_file": "data/lld/workflow-step-logger.py",
      "extensions": [
        "Persist to a database with a unique constraint on (workflow, step, sequence).",
        "Add idempotency keys so a retried worker call does not double-log.",
        "Emit transitions as OpenTelemetry events for tracing.",
        "Support per-workflow custom policies."
      ],
      "ai_exercise": {
        "flawed_file": "data/lld/workflow-step-logger.flawed.py",
        "bugs": [
          {
            "id": "b1",
            "category": "thread safety",
            "where": "record()",
            "bug": "Reads the current state, then appends, with no lock. Two workers can both move PENDING to RUNNING.",
            "fix": "Do the read, check, and append under one lock."
          },
          {
            "id": "b2",
            "category": "missing state",
            "where": "VALID",
            "bug": "No RETRYING or CANCELLED, and FAILED can go back to RUNNING silently. SUCCEEDED has no entry, so any move from it raises KeyError instead of a clear error.",
            "fix": "Model every state, make terminal states explicit, and add RETRYING."
          },
          {
            "id": "b3",
            "category": "SRP violation",
            "where": "record()",
            "bug": "The logger sends email over SMTP inside record(). Logging now blocks on the network, and an SMTP failure raises after the event was already stored.",
            "fix": "Move notifications to a listener (Observer) called after the write, isolated from failures."
          },
          {
            "id": "b4",
            "category": "leaky abstraction",
            "where": "get_history()",
            "bug": "Returns the internal list, and history is a public dict, so callers can change the log.",
            "fix": "Return a copy and keep storage private."
          },
          {
            "id": "b5",
            "category": "unhandled edge case",
            "where": "current_state(), get_history()",
            "bug": "Unknown workflow or step raises KeyError.",
            "fix": "Return None and an empty list for unknown keys."
          },
          {
            "id": "b6",
            "category": "other",
            "where": "record()",
            "bug": "datetime.now() is naive local time, so timestamps are ambiguous across hosts.",
            "fix": "Use timezone-aware UTC from an injectable clock."
          }
        ]
      }
    },
    {
      "id": "incident-state-machine",
      "title": "Incident ticket state machine",
      "reported": false,
      "pinned": false,
      "difficulty": "medium",
      "prompt": "",
      "requirements": [